{
  "$schema": "https://json-schema.org/draft/2020-12/schema",
  "title": "Localeo Atelier — Réponse IA V1",
  "description": "Contrat cible. Les références et la fraîcheur sont aussi contrôlées par le domaine.",
  "type": "object",
  "additionalProperties": false,
  "required": ["schema_version", "preparation_id", "contexte_id", "ville_id", "nom", "accroche", "description", "prestations", "visuel"],
  "properties": {
    "schema_version": {"const": "1"},
    "preparation_id": {"type": "string", "format": "uuid"},
    "contexte_id": {"type": "string", "format": "uuid"},
    "ville_id": {"type": "string", "format": "uuid"},
    "nom": {"type": "string", "minLength": 1, "maxLength": 200},
    "accroche": {"type": "string", "minLength": 1, "maxLength": 160},
    "description": {"type": "string", "minLength": 1, "maxLength": 4000},
    "prestations": {
      "type": "array", "minItems": 1, "maxItems": 20, "uniqueItems": true,
      "items": {
        "type": "object", "additionalProperties": false,
        "required": ["modele_id", "version"],
        "properties": {
          "modele_id": {"type": "string", "format": "uuid"},
          "version": {"type": "integer", "minimum": 1}
        }
      }
    },
    "visuel": {
      "type": "object", "additionalProperties": false,
      "required": ["mime_type", "contenu_base64", "texte_alternatif"],
      "properties": {
        "mime_type": {"const": "image/webp"},
        "contenu_base64": {"type": "string", "minLength": 4, "maxLength": 200000, "pattern": "^(?:[A-Za-z0-9+/]{4})*(?:[A-Za-z0-9+/]{2}==|[A-Za-z0-9+/]{3}=)?$"},
        "texte_alternatif": {"type": "string", "minLength": 1, "maxLength": 180}
      }
    }
  }
}
