{
  "schema_version": "1",
  "preparation_id": "11111111-1111-4111-8111-111111111111",
  "contexte_id": "22222222-2222-4222-8222-222222222222",
  "ville_id": "33333333-3333-4333-8333-333333333333",
  "nom": "Escapade gourmande et créative",
  "accroche": "Deux expériences pour découvrir les savoir-faire de votre commune.",
  "description": "Profitez d'une dégustation puis découvrez un atelier créatif auprès des commerçants sélectionnés. Consultez les conditions de chaque prestation pour préparer votre visite.",
  "prestations": [
    {"modele_id": "44444444-4444-4444-8444-444444444444", "version": 2},
    {"modele_id": "88888888-8888-4888-8888-888888888888", "version": 1}
  ],
  "visuel": {
    "mime_type": "image/webp",
    "contenu_base64": "UklGRjoAAABXRUJQVlA4IC4AAADQAQCdASoCAAIAAUAmJaACdLoB+AADsAD+88Jn/rK/mV/Mr/jAf+Smv8bcdgAA",
    "texte_alternatif": "Carré ocre servant uniquement de fixture technique."
  }
}
